{
  "entity": { "entity": { "id": "player-A", "type": "player" }, "name": "Вася" },
  "version": 1,
  "attributes": {
    "hp": 10,
    "hp_max": 10,
    "atk": 2,
    "def": 12,
    "dmg": "d6",
    "flee": "2",
    "status": "alive",
    "position": "outside:dark-forest-world",
    "scope": { "id": "player-A", "type": "solo" },
    "actor_kind": "ci",
    "inventory": []
  },
  "proposal_id": "01JG0000000000000000000020"
}
